{
  "schemaVersion": 1,
  "model": "deep",
  "internalContractRelease": "liquidity-growth-full-range-v1",
  "releaseVersion": "deep-full-range-v1",
  "status": "deployed-source-and-canary-verified-keeper-pending",
  "releaseEligible": false,
  "chainId": 1,
  "releaseCommit": "75d00e2369cd8bc67421859270c0fbf3edc478ff",
  "sourceCommitment": "0x82f6e2745dfbf54f40eae80df645bc75a7952e0505dd0621437dd233a619acfd",
  "startBlock": 25632831,
  "startingNonce": 34,
  "transactionCount": 6,
  "candidatePlan": {
    "status": "reviewed-refresh-at-signing",
    "observedAtBlock": 25632830,
    "deployer": "0x2Bb333d48DFAF1596D9036671d2E43168994249E",
    "startingNonce": 34,
    "feeSplitVaultFactory": "0xF15D4528Db481732Cdb94FC2558d04ce4D85Cb54",
    "hookFactory": "0xb003a14Ef04D5022A8CfB4158b49f77e2e73b5E9",
    "feeHook": "0x48dC3009eC1d3298BBA31f718A9A29d02fC9B0cC",
    "hookSalt": "0x0000000000000000000000000000000000000000000000000000000000012aab",
    "hookInitCodeHash": "0x516de7933394b3f0c47f19838cf3264153d1ef010c49d3a66ddaf85fde724025",
    "rangeSourceFactory": "0xb2Ec2573bB6968b9fA85f1A0b82E33bB0A388a43",
    "growthVaultFactory": "0x8A7a30A0aC4ae79Ba82248317Ad774F0B96b53dF",
    "growthVaultImplementation": "0x475C4F40A3eb6c294DEB9E59F52AA4d638C17471",
    "launcher": "0x7AEf9a4038FAbb1d477BbFD3A106F81b93EB5aeB",
    "automation": "0x856a8E8421e76f55CD1e0D65B4f3c1b474289b2f",
    "positionPlanner": "0xc713C9BEFde14893d2A6891192EA36B6da62E606"
  },
  "addresses": {
    "deployer": "0x2Bb333d48DFAF1596D9036671d2E43168994249E",
    "treasury": "0x4957f49620AFf3Adbbe8195a4f633E49cc93376c",
    "feeSplitVaultFactory": "0xF15D4528Db481732Cdb94FC2558d04ce4D85Cb54",
    "hookFactory": "0xb003a14Ef04D5022A8CfB4158b49f77e2e73b5E9",
    "feeHook": "0x48dC3009eC1d3298BBA31f718A9A29d02fC9B0cC",
    "rangeSourceFactory": "0xb2Ec2573bB6968b9fA85f1A0b82E33bB0A388a43",
    "growthVaultFactory": "0x8A7a30A0aC4ae79Ba82248317Ad774F0B96b53dF",
    "growthVaultImplementation": "0x475C4F40A3eb6c294DEB9E59F52AA4d638C17471",
    "launcher": "0x7AEf9a4038FAbb1d477BbFD3A106F81b93EB5aeB",
    "automation": "0x856a8E8421e76f55CD1e0D65B4f3c1b474289b2f",
    "positionPlanner": "0xc713C9BEFde14893d2A6891192EA36B6da62E606",
    "positionForwarderFactory": "0x291a9ff1059d225d02B1659430804486404dB507"
  },
  "transactions": {
    "feeSplitVaultFactory": "0x3ed55f6014249dccbfc6e0c0d2e8194bbac015e60f1dd0852fe90fe4a1e11077",
    "hookFactory": "0xe35877b27570e30bf8354933e9964b53bcfd2e42f2467e281a747fac59f9271e",
    "feeHook": "0x5f9d85dfaab541964c96785aaadbf222cacfdf280e7934e12846388e47ed29f7",
    "rangeSourceFactory": "0x4ab34f8002678bf15e03bc817a3ce6a3fb971b6872db789b9c5efa3e093cdc0c",
    "growthVaultFactory": "0xf55e60a16a4500d1e0b892b83c8a3c17c8fe56b54b18beb8557118128a128a88",
    "growthVaultImplementation": "0xf55e60a16a4500d1e0b892b83c8a3c17c8fe56b54b18beb8557118128a128a88",
    "launcher": "0xff94d678b007c2718b6d13e64702dbb9e9d02ce5fe24aa7678fbcf21dbff6669",
    "automation": "0xff94d678b007c2718b6d13e64702dbb9e9d02ce5fe24aa7678fbcf21dbff6669",
    "positionPlanner": "0xff94d678b007c2718b6d13e64702dbb9e9d02ce5fe24aa7678fbcf21dbff6669"
  },
  "deploymentBlocks": {
    "feeSplitVaultFactory": 25632831,
    "hookFactory": 25632850,
    "feeHook": 25632859,
    "rangeSourceFactory": 25632863,
    "growthVaultFactory": 25632867,
    "growthVaultImplementation": 25632867,
    "launcher": 25632886,
    "automation": 25632886,
    "positionPlanner": 25632886
  },
  "deploymentEvidence": {
    "feeSplitVaultFactory": {
      "transactionHash": "0x3ed55f6014249dccbfc6e0c0d2e8194bbac015e60f1dd0852fe90fe4a1e11077",
      "blockNumber": 25632831,
      "blockHash": "0xf1145570f647f38e88cae7915900dd04e8c03473b731ed07f7df0b789514bd93",
      "receiptStatus": "success",
      "nonce": 34,
      "valueWei": "0",
      "from": "0x2Bb333d48DFAF1596D9036671d2E43168994249E",
      "to": null,
      "transactionInputHash": "0xd17ede522c0892134e54d5c22433332c85a27e5ac7f2e6eaf7d2b401094076df"
    },
    "hookFactory": {
      "transactionHash": "0xe35877b27570e30bf8354933e9964b53bcfd2e42f2467e281a747fac59f9271e",
      "blockNumber": 25632850,
      "blockHash": "0x5bf020522a2a27e97362a42eaa88379d965c18b8f41954a4fa56a637cc2daed3",
      "receiptStatus": "success",
      "nonce": 35,
      "valueWei": "0",
      "from": "0x2Bb333d48DFAF1596D9036671d2E43168994249E",
      "to": null,
      "transactionInputHash": "0xa72fe6458c6fe2c3f7be2c9bbb94a1e9878b2bb94cd9719f9eece60ff725b5c8"
    },
    "feeHook": {
      "transactionHash": "0x5f9d85dfaab541964c96785aaadbf222cacfdf280e7934e12846388e47ed29f7",
      "blockNumber": 25632859,
      "blockHash": "0x4b93525642b19211f5aad7776e57b993dccc5e4816393ed3f64a3b47ab4e8acc",
      "receiptStatus": "success",
      "nonce": 36,
      "valueWei": "0",
      "from": "0x2Bb333d48DFAF1596D9036671d2E43168994249E",
      "to": "0xb003a14Ef04D5022A8CfB4158b49f77e2e73b5E9",
      "transactionInputHash": "0x19f7a0108dcea2235905666bc2d3f64d199c356de787f8551eedb9db9a34af1a"
    },
    "rangeSourceFactory": {
      "transactionHash": "0x4ab34f8002678bf15e03bc817a3ce6a3fb971b6872db789b9c5efa3e093cdc0c",
      "blockNumber": 25632863,
      "blockHash": "0x89cd6ad7e40bf6318ca35dbf960772bf9f9946913259d93ac281febc0ddb914e",
      "receiptStatus": "success",
      "nonce": 37,
      "valueWei": "0",
      "from": "0x2Bb333d48DFAF1596D9036671d2E43168994249E",
      "to": null,
      "transactionInputHash": "0x2cc752b1e6181ee5c0d3afa14f6795d60a27fa4d316ed9313c1ca24afc853b66"
    },
    "growthVaultFactory": {
      "transactionHash": "0xf55e60a16a4500d1e0b892b83c8a3c17c8fe56b54b18beb8557118128a128a88",
      "blockNumber": 25632867,
      "blockHash": "0xa7ed61de64a95c5844ffff7a885ca3eea5f457198740b7f383e819d6f7372ba6",
      "receiptStatus": "success",
      "nonce": 38,
      "valueWei": "0",
      "from": "0x2Bb333d48DFAF1596D9036671d2E43168994249E",
      "to": null,
      "transactionInputHash": "0x2e887ae43aea0dc8f544e4cc26dfbe8b421d1887511d23b93fad9b815e90effd"
    },
    "growthVaultImplementation": {
      "transactionHash": "0xf55e60a16a4500d1e0b892b83c8a3c17c8fe56b54b18beb8557118128a128a88",
      "blockNumber": 25632867,
      "blockHash": "0xa7ed61de64a95c5844ffff7a885ca3eea5f457198740b7f383e819d6f7372ba6",
      "receiptStatus": "success"
    },
    "launcher": {
      "transactionHash": "0xff94d678b007c2718b6d13e64702dbb9e9d02ce5fe24aa7678fbcf21dbff6669",
      "blockNumber": 25632886,
      "blockHash": "0xbcd824a846904baf171303a22912e8a2a8437d742647bce92ed8353b5ad884d1",
      "receiptStatus": "success",
      "nonce": 39,
      "valueWei": "0",
      "from": "0x2Bb333d48DFAF1596D9036671d2E43168994249E",
      "to": null,
      "transactionInputHash": "0x3e273e7651e217bab15ef450c41aeb302a7be61ef3c600aff7c05c56fcb14ddc"
    },
    "automation": {
      "transactionHash": "0xff94d678b007c2718b6d13e64702dbb9e9d02ce5fe24aa7678fbcf21dbff6669",
      "blockNumber": 25632886,
      "blockHash": "0xbcd824a846904baf171303a22912e8a2a8437d742647bce92ed8353b5ad884d1",
      "receiptStatus": "success"
    },
    "positionPlanner": {
      "transactionHash": "0xff94d678b007c2718b6d13e64702dbb9e9d02ce5fe24aa7678fbcf21dbff6669",
      "blockNumber": 25632886,
      "blockHash": "0xbcd824a846904baf171303a22912e8a2a8437d742647bce92ed8353b5ad884d1",
      "receiptStatus": "success"
    }
  },
  "runtimeCodeHashes": {
    "feeSplitVaultFactory": "0x6e0fed3c3598d32458b9c7ce04a97ae3e0cc847e4022e3dec5a14cd1f29c88fc",
    "hookFactory": "0x786c4720eeb3583c6021794e39360369f52510d2d0b29b8212b99bb9e6efe5ae",
    "feeHook": "0xda536944ead25d438a8a957ec1c7997115fb36d7e1af963d162b1ce99229b002",
    "rangeSourceFactory": "0x3c909216b8f1200c19d6d01f65b332fe3eca4728e27d671a86a346089df69373",
    "growthVaultFactory": "0xd732172bfd042198714315b963eaa082668627e5354fece6629ffdde598f43cf",
    "growthVaultImplementation": "0x761ce52efd302f6c5cf654385bbe465fca7a8748998b126311effd5b5aab7795",
    "launcher": "0xa2acb1f45f9d5baa4037d837b82e1a4fade65202406bdf530bad536b3a58cde0",
    "automation": "0x1b6cc50912806d27908a5e01abf30af392b909116e0d0f7321f828be52400ad8",
    "positionPlanner": "0x091099e5dda7392628b5935eeb1e2eeab687a170c3a6bddb79bb8b264d58a95a",
    "positionForwarderFactory": "0xcefd10b60f990984bb60c98eb53e66048bfd36da9b48200e8535f5ca39d58fb2"
  },
  "artifactRuntime": {
    "feeSplitVaultFactory": {
      "fqcn": "src/FeeSplitVaultFactoryV1.sol:FeeSplitVaultFactoryV1",
      "creationBytes": 7022,
      "creationCodeHash": "0xd17ede522c0892134e54d5c22433332c85a27e5ac7f2e6eaf7d2b401094076df",
      "bytes": 6994,
      "codeHash": "0x6e0fed3c3598d32458b9c7ce04a97ae3e0cc847e4022e3dec5a14cd1f29c88fc"
    },
    "feeSplitVault": {
      "fqcn": "src/FeeSplitVaultV1.sol:FeeSplitVaultV1",
      "creationBytes": 4979,
      "creationCodeHash": "0xc94474123f2846dbb6fcf9acdf4e4a77bb87b491aefa4e00e27dc9d7d42980c2",
      "bytes": 3186,
      "codeHash": "0x451705dfda2463ac571c13d60dc06e3b9f6c4ff5a388f5652b5566cd2ab4fb26"
    },
    "hookFactory": {
      "fqcn": "src/LiquidityGrowthFeeOracleHookFactoryV1.sol:LiquidityGrowthFeeOracleHookFactoryV1",
      "creationBytes": 21124,
      "creationCodeHash": "0xa72fe6458c6fe2c3f7be2c9bbb94a1e9878b2bb94cd9719f9eece60ff725b5c8",
      "bytes": 21096,
      "codeHash": "0x786c4720eeb3583c6021794e39360369f52510d2d0b29b8212b99bb9e6efe5ae"
    },
    "feeHookTemplate": {
      "fqcn": "src/LiquidityGrowthFeeOracleHookV1.sol:LiquidityGrowthFeeOracleHookV1",
      "creationBytes": 19291,
      "creationCodeHash": "0xb6941769ddda7186c5ac3ea484663ef351ed3ae70c107f1355f4a448a21b7117",
      "bytes": 18085,
      "codeHash": "0xc91b5c562fa7e9f9f17e672eefd418b67e8f168c740fc0315c956da9243a5d47",
      "note": "Runtime template before constructor immutable references are patched"
    },
    "rangeSourceFactory": {
      "fqcn": "src/LiquidityGrowthRangeSourceFactoryV1.sol:LiquidityGrowthRangeSourceFactoryV1",